<?xml version='1.0' encoding='utf-8'?>

<!ELEMENT sources (source*,source-sync*)>

<!ELEMENT source (connection-name, description?, field*, parameter*)>
<!ATTLIST source name CDATA #REQUIRED>
<!ELEMENT connection-name (#PCDATA)>

<!ELEMENT field (binary|constant|variable|expression)>
<!ATTLIST field name CDATA #REQUIRED>
<!ATTLIST field originalName CDATA #IMPLIED>
<!ATTLIST field primaryKey (true|first|false) "false">
<!ATTLIST field type CDATA #IMPLIED>
<!ATTLIST field length CDATA #IMPLIED>
<!ATTLIST field precision CDATA #IMPLIED>
<!ATTLIST field searchable CDATA #IMPLIED>
<!ATTLIST field unique CDATA #IMPLIED>
<!ATTLIST field index CDATA #IMPLIED>
<!ATTLIST field caseSensitive CDATA #IMPLIED>

<!ELEMENT binary (#PCDATA)>
<!ELEMENT constant (#PCDATA)>
<!ELEMENT variable (#PCDATA)>
<!ELEMENT expression (#PCDATA)>
<!ATTLIST expression foreach CDATA #IMPLIED>
<!ATTLIST expression var CDATA #IMPLIED>

<!ELEMENT source-sync (class-name?, description?, parameter*)>
<!ATTLIST source-sync name CDATA #IMPLIED>

<!ELEMENT class-name (#PCDATA)>

<!ELEMENT description (#PCDATA)>

<!ELEMENT parameter (param-name, param-value)>
<!ELEMENT param-name (#PCDATA)>
<!ELEMENT param-value (#PCDATA)>
