<?xml version="1.0" encoding="UTF-8"?>
<!DOCTYPE sources PUBLIC
  "-//Penrose/DTD Sources ${product.specification}//EN"
  "http://penrose.safehaus.org/dtd/sources.dtd">

<sources>

  <source name="posixAccount">
    <connection-name>Posix</connection-name>
    <field name="cn"/>
    <field name="uid" primaryKey="true"/>
    <field name="uidNumber" type="INTEGER"/>
    <field name="gidNumber" type="INTEGER"/>
    <field name="homeDirectory"/>
    <field name="userPassword"/>
    <field name="loginShell"/>
    <field name="gecos"/>
    <field name="description"/>
    <parameter>
      <param-name>table</param-name>
      <param-value>posixAccount</param-value>
    </parameter>
  </source>

  <source name="posixGroup">
    <connection-name>Posix</connection-name>
    <field name="cn" primaryKey="true"/>
    <field name="gidNumber" type="INTEGER"/>
    <field name="userPassword"/>
    <field name="description"/>
    <parameter>
      <param-name>table</param-name>
      <param-value>posixGroup</param-value>
    </parameter>
  </source>

  <source name="posixGroup_memberUid">
    <connection-name>Posix</connection-name>
    <field name="cn" primaryKey="true"/>
    <field name="memberUid" primaryKey="true"/>
    <parameter>
      <param-name>table</param-name>
      <param-value>posixGroup_memberUid</param-value>
    </parameter>
  </source>

  <source name="device">
    <connection-name>Posix</connection-name>
    <field name="cn" primaryKey="true"/>
    <field name="serialNumber"/>
    <field name="seeAlso"/>
    <field name="owner"/>
    <field name="ou"/>
    <field name="o"/>
    <field name="l"/>
    <field name="description"/>
    <parameter>
      <param-name>table</param-name>
      <param-value>device</param-value>
    </parameter>
  </source>

  <source name="ipHost">
    <connection-name>Posix</connection-name>
    <field name="cn" primaryKey="true"/>
    <field name="ipHostNumber"/>
    <parameter>
      <param-name>table</param-name>
      <param-value>ipHost</param-value>
    </parameter>
  </source>

  <source name="ipHost_cn">
    <connection-name>Posix</connection-name>
    <field name="cn" primaryKey="true"/>
    <field name="ipHostNumber" primaryKey="true"/>
    <parameter>
      <param-name>table</param-name>
      <param-value>ipHost_cn</param-value>
    </parameter>
  </source>

</sources>
