<?xml version="1.0" encoding="UTF-8"?>
<!DOCTYPE sources PUBLIC
  "-//Penrose/DTD Sources ${product.specification}//EN"
  "http://penrose.safehaus.org/dtd/sources.dtd">

<sources>

  <source name="LDAP">
    <connection-name>LDAP</connection-name>
  </source>

  <source name="locks">
    <connection-name>JDBC</connection-name>
    <field name="account" primaryKey="true"/>
    <field name="counter" type="INTEGER"/>
    <field name="timestamp" type="DATETIME"/>
    <parameter>
      <param-name>table</param-name>
      <param-value>locks</param-value>
    </parameter>
  </source>

</sources>
