<?xml version="1.0" encoding="UTF-8"?>
<!DOCTYPE sources PUBLIC
  "-//Penrose/DTD Sources ${product.specification}//EN"
  "http://penrose.safehaus.org/dtd/sources.dtd">

<sources>

  <source name="users">
    <connection-name>NIS</connection-name>
    <field name="cn"/>
    <field name="sn"/>
    <field name="uid" primaryKey="true"/>
    <field name="uidNumber"/>
    <field name="gidNumber"/>
    <field name="homeDirectory"/>
    <field name="userPassword"/>
    <field name="loginShell"/>
    <field name="gecos"/>
    <field name="description"/>
    <parameter>
      <param-name>objectClasses</param-name>
      <param-value>posixAccount</param-value>
    </parameter>
    <parameter>
      <param-name>base</param-name>
      <param-value>/etc/passwd</param-value>
    </parameter>
  </source>

  <source name="hosts">
    <connection-name>NIS</connection-name>
    <field name="cn" primaryKey="true"/>
    <field name="ipHostNumber"/>
    <parameter>
      <param-name>objectClasses</param-name>
      <param-value>ipHost</param-value>
    </parameter>
    <parameter>
      <param-name>base</param-name>
      <param-value>/etc/hosts</param-value>
    </parameter>
  </source>

  <source name="groups">
    <connection-name>NIS</connection-name>
    <field name="cn" primaryKey="true"/>
    <field name="gidNumber"/>
    <field name="userPassword"/>
    <field name="memberUid"/>
    <field name="description"/>
    <parameter>
      <param-name>objectClasses</param-name>
      <param-value>posixGroup</param-value>
    </parameter>
    <parameter>
      <param-name>base</param-name>
      <param-value>/etc/group</param-value>
    </parameter>
  </source>

  <source name="services">
    <connection-name>NIS</connection-name>
    <field name="name"/>
    <field name="cn"/>
    <field name="ipServicePort" primaryKey="true"/>
    <field name="ipServiceProtocol" primaryKey="true"/>
    <field name="description"/>
    <parameter>
      <param-name>objectClasses</param-name>
      <param-value>ipService</param-value>
    </parameter>
    <parameter>
      <param-name>base</param-name>
      <param-value>/etc/services</param-value>
    </parameter>
  </source>

  <source name="rpcs">
    <connection-name>NIS</connection-name>
    <field name="cn" primaryKey="true"/>
    <field name="oncRpcNumber"/>
    <field name="description"/>
    <parameter>
      <param-name>objectClasses</param-name>
      <param-value>oncRpc</param-value>
    </parameter>
    <parameter>
      <param-name>base</param-name>
      <param-value>/etc/rpc</param-value>
    </parameter>
  </source>

  <source name="netids">
    <connection-name>NIS</connection-name>
    <field name="cn" primaryKey="true"/>
    <field name="nisNetIdUser"/>
    <field name="nisNetIdGroup"/>
    <field name="nisNetIdHost"/>
    <parameter>
      <param-name>objectClasses</param-name>
      <param-value>nisNetId</param-value>
    </parameter>
    <parameter>
      <param-name>base</param-name>
      <param-value>/etc/netid</param-value>
    </parameter>
  </source>

  <source name="protocols">
    <connection-name>NIS</connection-name>
    <field name="cn" primaryKey="true"/>
    <field name="ipProtocolNumber"/>
    <field name="description"/>
    <parameter>
      <param-name>objectClasses</param-name>
      <param-value>ipProtocol</param-value>
    </parameter>
    <parameter>
      <param-name>base</param-name>
      <param-value>/etc/protocols</param-value>
    </parameter>
  </source>

  <source name="aliases">
    <connection-name>NIS</connection-name>
    <field name="cn" primaryKey="true"/>
    <field name="rfc822mailMember" originalName="mail"/>
    <parameter>
      <param-name>objectClasses</param-name>
      <param-value>nisMailAlias</param-value>
    </parameter>
    <parameter>
      <param-name>base</param-name>
      <param-value>/etc/aliases</param-value>
    </parameter>
  </source>

  <source name="netgroups">
    <connection-name>NIS</connection-name>
    <field name="cn" primaryKey="true"/>
    <field name="nisNetgroupTriple"/>
    <field name="memberNisNetgroup"/>
    <field name="description"/>
    <parameter>
      <param-name>objectClasses</param-name>
      <param-value>nisNetgroup</param-value>
    </parameter>
    <parameter>
      <param-name>base</param-name>
      <param-value>/etc/netgroup</param-value>
    </parameter>
  </source>

  <source name="ethers">
    <connection-name>NIS</connection-name>
    <field name="cn" primaryKey="true"/>
    <field name="macAddress"/>
    <parameter>
      <param-name>objectClasses</param-name>
      <param-value>ieee802Device</param-value>
    </parameter>
    <parameter>
      <param-name>base</param-name>
      <param-value>/etc/ethers</param-value>
    </parameter>
  </source>

  <source name="bootparams">
    <connection-name>NIS</connection-name>
    <field name="cn" primaryKey="true"/>
    <field name="bootFile"/>
    <field name="bootParameter"/>
    <parameter>
      <param-name>objectClasses</param-name>
      <param-value>bootableDevice</param-value>
    </parameter>
    <parameter>
      <param-name>base</param-name>
      <param-value>/etc/bootparams</param-value>
    </parameter>
  </source>

  <source name="networks">
    <connection-name>NIS</connection-name>
    <field name="cn" primaryKey="true"/>
    <field name="ipNetworkNumber"/>
    <parameter>
      <param-name>objectClasses</param-name>
      <param-value>ipNetwork</param-value>
    </parameter>
    <parameter>
      <param-name>base</param-name>
      <param-value>/etc/networks</param-value>
    </parameter>
  </source>

  <source name="auto_master">
    <connection-name>NIS</connection-name>
    <field name="cn" primaryKey="true"/>
    <field name="automountInformation"/>
    <field name="description"/>
    <parameter>
      <param-name>objectClasses</param-name>
      <param-value>automount</param-value>
    </parameter>
    <parameter>
      <param-name>base</param-name>
      <param-value>/etc/auto.master</param-value>
    </parameter>
  </source>

  <source name="auto_home">
    <connection-name>NIS</connection-name>
    <field name="cn" primaryKey="true"/>
    <field name="automountInformation"/>
    <field name="description"/>
    <parameter>
      <param-name>objectClasses</param-name>
      <param-value>automount</param-value>
    </parameter>
    <parameter>
      <param-name>base</param-name>
      <param-value>/etc/auto.home</param-value>
    </parameter>
  </source>

</sources>
