<?xml version="1.0" encoding="UTF-8"?>
<!DOCTYPE sources PUBLIC
  "-//Penrose/DTD Sources ${product.specification}//EN"
  "http://penrose.safehaus.org/dtd/sources.dtd">

<sources>

  <source name="users1">
    <connection-name>AD</connection-name>
    <field name="dn"/>
    <field name="uid" originalName="sAMAccountName" primaryKey="true"/>
    <field name="cn"/>
    <field name="sn"/>
    <field name="givenName"/>
    <parameter>
      <param-name>objectClasses</param-name>
      <param-value>user</param-value>
    </parameter>
    <parameter>
      <param-name>baseDn</param-name>
      <param-value>dc=Example,dc=com</param-value>
    </parameter>
    <parameter>
      <param-name>scope</param-name>
      <param-value>SUBTREE</param-value>
    </parameter>
    <parameter>
      <param-name>filter</param-name>
      <param-value>(objectClass=user)</param-value>
    </parameter>
  </source>

  <source name="users2">
    <connection-name>LDAP</connection-name>
    <field name="dn"/>
    <field name="uid" primaryKey="true"/>
    <field name="cn"/>
    <field name="sn"/>
    <field name="givenName"/>
    <parameter>
      <param-name>objectClasses</param-name>
      <param-value>account,posixAccount</param-value>
    </parameter>
    <parameter>
      <param-name>baseDn</param-name>
      <param-value>dc=Example,dc=com</param-value>
    </parameter>
    <parameter>
      <param-name>scope</param-name>
      <param-value>SUBTREE</param-value>
    </parameter>
    <parameter>
      <param-name>filter</param-name>
      <param-value>(objectClass=posixAccount)</param-value>
    </parameter>
  </source>

  <source name="groups1">
    <connection-name>AD</connection-name>
    <field name="dn"/>
    <field name="cn" primaryKey="true"/>
    <field name="memberUid" originalName="member"/>
    <parameter>
      <param-name>objectClasses</param-name>
      <param-value>group</param-value>
    </parameter>
    <parameter>
      <param-name>baseDn</param-name>
      <param-value>dc=Example,dc=com</param-value>
    </parameter>
    <parameter>
      <param-name>scope</param-name>
      <param-value>SUBTREE</param-value>
    </parameter>
    <parameter>
      <param-name>filter</param-name>
      <param-value>(objectClass=group)</param-value>
    </parameter>
  </source>

  <source name="groups2">
    <connection-name>LDAP</connection-name>
    <field name="dn"/>
    <field name="cn" primaryKey="true"/>
    <field name="memberUid"/>
    <parameter>
      <param-name>objectClasses</param-name>
      <param-value>posixGroup</param-value>
    </parameter>
    <parameter>
      <param-name>baseDn</param-name>
      <param-value>dc=Example,dc=com</param-value>
    </parameter>
    <parameter>
      <param-name>scope</param-name>
      <param-value>SUBTREE</param-value>
    </parameter>
    <parameter>
      <param-name>filter</param-name>
      <param-value>(objectClass=posixGroup)</param-value>
    </parameter>
  </source>

</sources>
