<?xml version="1.0" encoding="UTF-8"?>
<!DOCTYPE sources PUBLIC
  "-//Penrose/DTD Sources ${product.specification}//EN"
  "http://penrose.safehaus.org/dtd/sources.dtd">

<sources>

  <source name="jdbc.users">
    <connection-name>MySQL</connection-name>
    <field name="username" primaryKey="true"/>
    <field name="firstName"/>
    <field name="lastName"/>
    <field name="password"/>
    <parameter>
      <param-name>table</param-name>
      <param-value>users</param-value>
    </parameter>
  </source>

  <source name="ldap.users">
    <connection-name>OpenLDAP</connection-name>
    <field name="uid" primaryKey="true"/>
    <field name="cn"/>
    <field name="sn"/>
    <field name="userPassword"/>
    <parameter>
      <param-name>baseDn</param-name>
      <param-value>ou=Users,dc=my-domain,dc=com</param-value>
    </parameter>
    <parameter>
      <param-name>scope</param-name>
      <param-value>ONELEVEL</param-value>
      </parameter>
    <parameter>
      <param-name>filter</param-name>
      <param-value>(objectClass=*)</param-value>
    </parameter>
    <parameter>
      <param-name>objectClasses</param-name>
      <param-value>person,organizationalPerson,inetOrgPerson</param-value>
    </parameter>
  </source>

  <source name="jdbc.groups">
    <connection-name>MySQL</connection-name>
    <field name="groupname" primaryKey="true"/>
    <parameter>
      <param-name>table</param-name>
      <param-value>groups</param-value>
    </parameter>
  </source>

  <source name="ldap.groups">
    <connection-name>OpenLDAP</connection-name>
    <field name="cn" primaryKey="true"/>
    <field name="uniqueMember"/>
    <parameter>
      <param-name>baseDn</param-name>
      <param-value>ou=Groups,dc=my-domain,dc=com</param-value>
    </parameter>
    <parameter>
      <param-name>scope</param-name>
      <param-value>ONELEVEL</param-value>
    </parameter>
    <parameter>
      <param-name>filter</param-name>
      <param-value>(objectClass=*)</param-value>
    </parameter>
    <parameter>
      <param-name>objectClasses</param-name>
      <param-value>groupOfUniqueNames</param-value>
    </parameter>
  </source>

</sources>
