<?xml version="1.0" encoding="UTF-8"?>
<!DOCTYPE sources PUBLIC
  "-//Penrose/DTD Sources ${product.specification}//EN"
  "http://penrose.safehaus.org/dtd/sources.dtd">

<sources>

  <source name="changelog">
    <connection-name>MySQL</connection-name>
    <field name="changeNumber" type="INTEGER" primaryKey="true" autoIncrement="true"/>
    <field name="targetDN" type="TEXT"/>
    <field name="changeType" type="VARCHAR" length="255"/>
    <field name="changes" type="TEXT"/>
    <field name="newRDN" type="TEXT"/>
    <field name="deleteOldRDN" type="BOOLEAN"/>
    <field name="newSuperior" type="TEXT"/>
    <parameter>
      <param-name>table</param-name>
      <param-value>changelog</param-value>
    </parameter>
  </source>

</sources>
