<?xml version="1.0" encoding="UTF-8"?>
<!DOCTYPE sources PUBLIC
  "-//Penrose/DTD Sources 1.0//EN"
  "http://penrose.safehaus.org/dtd/sources.dtd">

<sources>

  <source name="users">
    <connection-name>SunONE</connection-name>
    <field name="uid" primaryKey="true"/>
    <field name="cn"/>
    <field name="sn"/>
    <field name="givenName"/>
    <field name="ou"/>
    <field name="l"/>
    <field name="mail"/>
    <field name="telephoneNumber"/>
    <field name="facsimileTelephoneNumber"/>
    <field name="roomNumber"/>
    <field name="userPassword"/>
    <parameter>
      <param-name>baseDn</param-name>
      <param-value>ou=People,dc=Example,dc=com</param-value>
    </parameter>
    <parameter>
      <param-name>scope</param-name>
      <param-value>ONELEVEL</param-value>
    </parameter>
    <parameter>
      <param-name>filter</param-name>
      <param-value>(objectClass=*)</param-value>
    </parameter>
    <parameter>
      <param-name>objectClasses</param-name>
      <param-value>person,organizationalPerson,inetOrgPerson</param-value>
    </parameter>
  </source>

  <source name="groups">
    <connection-name>SunONE</connection-name>
    <field name="cn" primaryKey="true"/>
    <field name="ou"/>
    <field name="uniqueMember"/>
    <parameter>
      <param-name>baseDn</param-name>
      <param-value>ou=Groups,dc=Example,dc=com</param-value>
    </parameter>
    <parameter>
      <param-name>scope</param-name>
      <param-value>ONELEVEL</param-value>
    </parameter>
    <parameter>
      <param-name>filter</param-name>
      <param-value>(objectClass=*)</param-value>
    </parameter>
    <parameter>
      <param-name>objectClasses</param-name>
      <param-value>groupOfUniqueNames</param-value>
    </parameter>
  </source>

</sources>
