<?xml version="1.0" encoding="UTF-8"?>
<!DOCTYPE sources PUBLIC
  "-//Penrose/DTD Sources ${product.specification}//EN"
  "http://penrose.safehaus.org/dtd/sources.dtd">

<sources>

  <source name="source">
    <connection-name>Penrose</connection-name>
    <parameter>
      <param-name>baseDn</param-name>
      <param-value>dc=Example,dc=com</param-value>
    </parameter>
  </source>

  <source name="target">
    <connection-name>OpenLDAP</connection-name>
    <parameter>
      <param-name>baseDn</param-name>
      <param-value>dc=Example,dc=com</param-value>
    </parameter>
  </source>

  <source name="changelog">
    <connection-name>Penrose</connection-name>
    <parameter>
      <param-name>baseDn</param-name>
      <param-value>cn=changelog</param-value>
    </parameter>
    <parameter>
      <param-name>scope</param-name>
      <param-value>ONELEVEL</param-value>
    </parameter>
  </source>

  <source name="tracker">
    <connection-name>MySQL</connection-name>
    <field name="changeNumber" type="INTEGER" primaryKey="true"/>
    <field name="changeTimestamp" type="DATETIME"/>
    <parameter>
      <param-name>table</param-name>
      <param-value>tracker</param-value>
    </parameter>
  </source>

</sources>
