<?xml version="1.0" encoding="UTF-8"?>
<!DOCTYPE sources PUBLIC
  "-//Penrose/DTD Sources ${product.specification}//EN"
  "http://penrose.safehaus.org/dtd/sources.dtd">

<sources>

  <source name="LDAP">
    <connection-name>LDAP</connection-name>
    <parameter>
      <param-name>baseDn</param-name>
      <param-value>${LDAP_SUFFIX}</param-value>
    </parameter>
  </source>
<!--
  <source name="changes">
    <connection-name>Database</connection-name>
    <field name="id" type="INTEGER" primaryKey="true" autoIncrement="true"
        originalType="INTEGER generated by default as identity"/>
    <field name="time" type="DATETIME"/>
    <field name="title" type="TEXT" originalType="VARCHAR"/>
    <field name="description" type="TEXT" originalType="VARCHAR"/>
    <parameter>
      <param-name>table</param-name>
      <param-value>changes</param-value>
    </parameter>
    <parameter>
      <param-name>create</param-name>
      <param-value>true</param-value>
    </parameter>
  </source>
-->
  <source name="errors">
    <connection-name>Database</connection-name>
    <field name="id" type="INTEGER" primaryKey="true" autoIncrement="true"
        originalType="INTEGER generated by default as identity"/>
    <field name="time" type="DATETIME"/>
    <field name="title" type="TEXT" originalType="VARCHAR"/>
    <field name="description" type="TEXT" originalType="VARCHAR"/>
    <parameter>
      <param-name>table</param-name>
      <param-value>errors</param-value>
    </parameter>
    <parameter>
      <param-name>create</param-name>
      <param-value>true</param-value>
    </parameter>
  </source>

</sources>